Semester	火/Tue.	1			D110	011105BP	英語中級B BP	Intermediate English B BP	サンダーズ 美里	SAUNDERS Misato		1	言語/Language	英語English
Semester	火/Tue.	1			D305	011105BQ	英語中級B BQ	Intermediate English B BQ	FORTUNA Roniel	FORTUNA Roniel Sanchez		1	言語/Language	英語English
Semester	火/Tue.	1			D301	011105BR	英語中級B BR	Intermediate English B BR	APPLE Derrick	APPLE Derrick Alan		1	言語/Language	英語English
Semester	火/Tue.	1			D203	011105BS	英語中級B BS	Intermediate English B BS	KERR Joshua	KERR Joshua Earl		1	言語/Language	英語English
Semester	火/Tue.	1			D207	011105BT	英語中級B BT	Intermediate English B BT	SAUNDERS Matt	SAUNDERS Matt		1	言語/Language	英語English
Semester	火/Tue.	1			D111	011107BN	英語準上級B BN	Upper Intermediate English B BN	JAI Rheumi Rhubi	JAI Rheumi Rhubi		1	言語/Language	英語English
Semester	火/Tue.	1			D202	011107BP	英語準上級B BP	Upper Intermediate English B BP	WALLER Roland C.	WALLER Roland C.		1	言語/Language	英語English
Semester	火/Tue.	1			D210	011107BQ	英語準上級B BQ	Upper Intermediate English B BQ	PADFIELD Sarah	PADFIELD Sarah Catherine		1	言語/Language	英語English
Semester	火/Tue.	1			D212	011201BB	英語上級1B BB	Advanced English 1B BB	RENTLER Benjamin	RENTLER Benjamin Robert		1	言語/Language	言語教育科目および共通教養科目Language Education Subjects and Common Liberal Arts Subjects
Semester	火/Tue.	1			D302	011202AB	英語上級2A AB	Advanced English 2A AB	ARMSTRONG Luke	ARMSTRONG Luke		1	言語/Language	言語教育科目および共通教養科目Language Education Subjects and Common Liberal Arts Subjects
Semester	火/Tue.	1			F106	020031JB	経済学入門JB	Introduction to EconomicsJB	大塚 宏蔵	OTSUKA KOZO	J	2	教養/Liberal Arts	共通教養科目Common Liberal Arts Subjects
Semester	火/Tue.	1			F201	020039JA	観光学入門JA	Introduction to Tourism and HospitalityJA	吉澤 清良	YOSHIZAWA Kiyoyoshi	J	1	教養/Liberal Arts	共通教養科目Common Liberal Arts SubjectorHT必修共通教養科目(*2)HT Required Common Liberal Arts Subject(*2)
Semester	火/Tue.	1			J105	027006JA	海外学習デザインJA	Overseas Learning DesignJA	カッティング 美紀	CUTTING Miki	J	1	教養/Liberal Arts	共通教養科目Common Liberal Arts Subjects
Semester	火/Tue.	1			和心庵	027029EC	茶道EC	Japanese Art of Tea CeremonyEC	宗泰 ポンパン	SOTAI Pongpan	E	3	教養/Liberal Arts	共通教養科目Common Liberal Arts Subjects
Semester	火/Tue.	1			F203	030600EB	金融論EB	FinanceEB	屈 程程	QU Chengcheng	E	3	他学部/Other College	他学部科目Other College Subjects
Semester	火/Tue.	1			H101	030630JA	生産管理論JA	Production ManagementJA	藤田 正典	FUJITA Masanori	J	3	他学部/Other College	他学部科目Other College Subjects
1Q	火/Tue.	1			IPS 5	030184JA	紛争と開発JA	Conflict and DevelopmentJA	淵ノ上 英樹	FUCHINOUE Hideki	J	3	専門/Major	APS専門教育科目APS Major Education Subjects orED専門教育科目(*1)ED Major Education Subjects (*1)orIRP専門教育科目(*3)IRP Major Education Subjects(*3)
1Q	火/Tue.	1			F105	030186EA	アジア太平洋の比較政治経済EA	Comparative Political Economy of the Asia PacificEA	VYAS Utpal	VYAS Utpal	E	3	専門/Major	APS専門教育科目APS Major Education Subjects orIRP専門教育科目(*3)IRP Major Education Subjects (*3)
1Q	火/Tue.	1			J102	030261EA	開発社会学・人類学EA	Development Sociology and AnthropologyEA	SALAZAR Robert A.C.	SALAZAR Robert A.C.	E	3	専門/Major	APS専門教育科目APS Major Education Subjects orED専門教育科目(*1)ED Major Education Subjects(*1) 
1Q	火/Tue.	1			F204	033030JA	経営戦略論JA	Strategic ManagementJA	奥山 亮	OKUYAMA Ryo	J	3	他学部/Other College	他学部科目Other College Subjects
1Q	火/Tue.	1			F202	037122EA	メディアと法EA	Media and LawEA	GUNARTO Hary	GUNARTO Hary	E	3	専門/Major	APS専門教育科目APS Major Education Subjects orCSM専門教育科目(*4)CSM Major Education Subjects (*4)
2Q	火/Tue.	1			T.B.A.	027025EA	環境科学EA	Environmental ScienceEA	MAHICHI Faezeh	MAHICHI Faezeh	E	3	教養/Liberal Arts	共通教養科目Common Liberal Arts Subjects
2Q	火/Tue.	1			T.B.A.	030187EA	アジア太平洋における国際関係EA	International Relations in the Asia PacificEA	陳 慶昌	CHEN Ching-Chang	E	5	専門/Major	APS専門教育科目APS Major Education Subjects orIRP専門教育科目(*3)IRP Major Education Subjects (*3)
2Q	火/Tue.	1			T.B.A.	030269EA	開発のプロジェクト・マネジメントEA	Project Management in DevelopmentEA	天津 邦明	AMATSU Kuniaki	E	5	専門/Major	APS専門教育科目APS Major Education Subjects orED専門教育科目(*1)ED Major Education Subjects (*1)orHT専門教育科目(*2)HT Major Education Subjects (*2)
2Q	火/Tue.	1			T.B.A.	033019JA	アントレプレナーシップJA	EntrepreneurshipJA	奥山 亮	OKUYAMA Ryo	J	3	他学部/Other College	他学部科目Other College Subjects
2Q	火/Tue.	1	〇	929 9761 4467	---	033030EB	Online)経営戦略論EB	Online)Strategic ManagementEB	HAIDAR Ali	HAIDAR Ali	E	3	他学部/Other College	他学部科目Other College Subjects
2Q	火/Tue.	1			T.B.A.	037125JA	平和学JA	Peace StudiesJA	淵ノ上 英樹	FUCHINOUE Hideki	J	3	専門/Major	APS専門教育科目APS Major Education Subjects orIRP専門教育科目(*3)IRP Major Education Subjects (*3)
2Q	火/Tue.	1			T.B.A.	037136EA	観光開発と計画EA	Tourism Development and PlanningEA	BOUKAMBA Kimo H.	BOUKAMBA Kimo Hermann	E	5	専門/Major	APS専門教育科目APS Major Education Subjects orHT専門教育科目(*2)HT Major Education Subjects (*2)
Semester	火/Tue.	2			F304	010081AA	日本語初級Ⅰ AA	Japanese Foundation Course I AA	米 冰寒	MI Binghan		1	言語/Language	-
Semester	火/Tue.	2			F211	010081AB	日本語初級Ⅰ AB	Japanese Foundation Course I AB	寺井 敦子	TERAI Atsuko		1	言語/Language	-
Semester	火/Tue.	2			F213	010081AC	日本語初級Ⅰ AC	Japanese Foundation Course I AC	成 利楽	CHENG Lile		1	言語/Language	-
Semester	火/Tue.	2			F212	010081AD	日本語初級Ⅰ AD	Japanese Foundation Course I AD	寺本 真悠子	TERAMOTO Mayuko		1	言語/Language	-
Semester	火/Tue.	2			F207	010081AE	日本語初級Ⅰ AE	Japanese Foundation Course I AE	山門 健二	YAMADO Kenji		1	言語/Language	-
Semester	火/Tue.	2			F302	010081AF	日本語初級Ⅰ AF	Japanese Foundation Course I AF	大内 由紀	OUCHI Yuki		1	言語/Language	-
Semester	火/Tue.	2			F111	010101AA	日本語中級 AA	Japanese Intermediate Course AA	布尾 勝一郎	NUNOO Katsuichiro		1	言語/Language	-
Semester	火/Tue.	2			D107	010101AB	日本語中級 AB	Japanese Intermediate Course AB	深山 道助	MIYAMA MICHISUKE		1	言語/Language	-
Semester	火/Tue.	2			D305	010101AC	日本語中級 AC	Japanese Intermediate Course AC	多田 利恵	TADA Rie		1	言語/Language	-
Semester	火/Tue.	2			F214	010101AD	日本語中級 AD	Japanese Intermediate Course AD	小野田 千絵	ONODA Chie		1	言語/Language	-
Semester	火/Tue.	2			FⅡ230	010101AE	日本語中級 AE	Japanese Intermediate Course AE	栃原 玲子	TOCHIHARA Reiko		1	言語/Language	-
Semester	火/Tue.	2			F208	010101AF	日本語中級 AF	Japanese Intermediate Course AF	星野 智子	HOSHINO Tomoko		1	言語/Language	-
Semester	火/Tue.	2			F303	010101AG	日本語中級 AG	Japanese Intermediate Course AG	津田 真理子	TSUDA Mariko		1	言語/Language	-
Semester	火/Tue.	2			FⅡ231	010101AH	日本語中級 AH	Japanese Intermediate Course AH	佐々木 美江	SASAKI Mie		1	言語/Language	-
Semester	火/Tue.	2			F205	010102AA	日本語中上級 AA	Pre-Advanced Japanese AA	石村 文恵	ISHIMURA Fumie		1	言語/Language	-
Semester	火/Tue.	2			F108	010102AB	日本語中上級 AB	Pre-Advanced Japanese AB	伊藤 俊也	ITO Toshinari		1	言語/Language	-
Semester	火/Tue.	2			F206	010102AC	日本語中上級 AC	Pre-Advanced Japanese AC	高松 知恵美	TAKAMATSU Chiemi		1	言語/Language	-
Semester	火/Tue.	2			FⅡ229	010103AA	日本語上級 AA	Advanced Japanese AA	廣津 公子	HIROTSU Koko		1	言語/Language	-
Semester	火/Tue.	2			D108	010103AB	日本語上級 AB	Advanced Japanese AB	板橋 民子	ITABASHI Tamiko		1	言語/Language	-
Semester	火/Tue.	2			FⅡ320	010180SC	中国語Ⅰ SC	Chinese I SC	河原畑 希久	KAWARABATA Kiku		1	言語/Language	言語教育科目および共通教養科目Language Education Subjects and Common Liberal Arts Subjects
Semester	火/Tue.	2			FⅡ328	010180SJ	中国語Ⅰ SJ	Chinese I SJ	張 玲	ZHANG Ling		1	言語/Language	言語教育科目および共通教養科目Language Education Subjects and Common Liberal Arts Subjects
Semester	火/Tue.	2			FⅡ325	010190SA	中国語Ⅱ SA	Chinese II SA	羅 華	LUO Hua		1	言語/Language	言語教育科目および共通教養科目Language Education Subjects and Common Liberal Arts Subjects
Semester	火/Tue.	2			FⅡ322	010200SB	中国語Ⅲ SB	Chinese III SB	李 娜	LI Na		1	言語/Language	言語教育科目および共通教養科目Language Education Subjects and Common Liberal Arts Subjects
Semester	火/Tue.	2			FⅡ324	010210SA	中国語Ⅳ SA	Chinese IV SA	張 文青	ZHANG Wenqing		1	言語/Language	言語教育科目および共通教養科目Language Education Subjects and Common Liberal Arts Subjects
Semester	火/Tue.	2			J307	010220SA	韓国語Ⅰ SA	Korean I SA	李 ソヨン	LEE Soyeong		1	言語/Language	言語教育科目および共通教養科目Language Education Subjects and Common Liberal Arts Subjects
Semester	火/Tue.	2			J304	010220SE	韓国語Ⅰ SE	Korean I SE	CHO Heejin	CHO Heejin		1	言語/Language	言語教育科目および共通教養科目Language Education Subjects and Common Liberal Arts Subjects
Semester	火/Tue.	2			J308	010220SJ	韓国語Ⅰ SJ	Korean I SJ	金 奈愛	KIM Naae		1	言語/Language	言語教育科目および共通教養科目Language Education Subjects and Common Liberal Arts Subjects
Semester	火/Tue.	2			FⅡ327	010260SA	マレー語･インドネシア語Ⅰ SA	Malay/Indonesian I SA	ELVITA Wiasih	ELVITA Wiasih		1	言語/Language	言語教育科目および共通教養科目Language Education Subjects and Common Liberal Arts Subjects
Semester	火/Tue.	2			FⅡ326	010270SA	マレー語･インドネシア語Ⅱ SA	Malay/Indonesian II SA	SRI Budi Lestari	SRI Budi Lestari		1	言語/Language	言語教育科目および共通教養科目Language Education Subjects and Common Liberal Arts Subjects
Semester	火/Tue.	2			FⅡ329	010280SA	マレー語･インドネシア語Ⅲ SA	Malay/Indonesian III SA	藤崎 拓海	FUJISAKI Takumi		1	言語/Language	言語教育科目および共通教養科目Language Education Subjects and Common Liberal Arts Subjects
Semester	火/Tue.	2			FⅡ223	010290SA	スペイン語Ⅰ SA	Spanish I SA	福川 美沙	FUKUKAWA Misa		1	言語/Language	言語教育科目および共通教養科目Language Education Subjects and Common Liberal Arts Subjects
Semester	火/Tue.	2			FⅡ224	010290SD	スペイン語Ⅰ SD	Spanish I SD	VILA LOPEZ Eduardo	VILA LOPEZ Eduardo		1	言語/Language	言語教育科目および共通教養科目Language Education Subjects and Common Liberal Arts Subjects
Semester	火/Tue.	2			FⅡ225	010300SC	スペイン語Ⅱ SC	Spanish II SC	MOLINA Noemi	MOLINA RODRIGUEZ Noemi		1	言語/Language	言語教育科目および共通教養科目Language Education Subjects and Common Liberal Arts Subjects
Semester	火/Tue.	2			FⅡ228	010320SB	タイ語Ⅰ SB	Thai I SB	PHANKHIAN Areeluck	PHANKHIAN Areeluck		1	言語/Language	言語教育科目および共通教養科目Language Education Subjects and Common Liberal Arts Subjects
Semester	火/Tue.	2			FⅡ227	010320SC	タイ語Ⅰ SC	Thai I SC	PIAMVIMON Piamkamon	PIAMVIMON Piamkamon		1	言語/Language	言語教育科目および共通教養科目Language Education Subjects and Common Liberal Arts Subjects
Semester	火/Tue.	2			FⅡ226	010330SA	タイ語Ⅱ SA	Thai II SA	LIMTHANANUNTHA P.	LIMTHANANUNTHA Phenssinee		1	言語/Language	言語教育科目および共通教養科目Language Education Subjects and Common Liberal Arts Subjects
Semester	火/Tue.	2			FⅡ331	010350SB	ベトナム語Ⅰ SB	Vietnamese I SB	NGUYEN Ha Thi Thanh	NGUYEN Ha Thi Thanh		1	言語/Language	言語教育科目および共通教養科目Language Education Subjects and Common Liberal Arts Subjects
Semester	火/Tue.	2			FⅡ330	010360SA	ベトナム語Ⅱ SA	Vietnamese II SA	NGUYEN Hoang Minh	NGUYEN Hoang Minh		1	言語/Language	言語教育科目および共通教養科目Language Education Subjects and Common Liberal Arts Subjects
Semester	火/Tue.	2			D214	011100AA	英語初級A AA	Elementary English A AA	PIGNOLET Lucas	PIGNOLET Lucas		1	言語/Language	英語English
Semester	火/Tue.	2			D301	011100AB	英語初級A AB	Elementary English A AB	LARKING Malcolm	LARKING Malcolm		1	言語/Language	英語English
Semester	火/Tue.	2			FⅡ123	011100AC	英語初級A AC	Elementary English A AC	斉藤 沙綾香	SAITO Sayaka		1	言語/Language	英語English
Semester	火/Tue.	2			FⅡ124	011100AD	英語初級A AD	Elementary English A AD	石毛 愛佳	ISHIGE Aika		1	言語/Language	英語English
Semester	火/Tue.	2			D104	011100AE	英語初級A AE	Elementary English A AE	BERNARD Malia Ana	BERNARD Malia Ana		1	言語/Language	英語English
Semester	火/Tue.	2			D103	011100AF	英語初級A AF	Elementary English A AF	BEUCKENS Roger Todd	BEUCKENS Roger Todd		1	言語/Language	英語English
Semester	火/Tue.	2			D105	011105BA	英語中級B BA	Intermediate English B BA	ベルガー 舞子	BERGER Maiko		1	言語/Language	英語English
Semester	火/Tue.	2			D205	011105BB	英語中級B BB	Intermediate English B BB	MCGRATH Darby	MCGRATH Darby		1	言語/Language	英語English
Semester	火/Tue.	2			D207	011105BC	英語中級B BC	Intermediate English B BC	SAUNDERS Matt	SAUNDERS Matt		1	言語/Language	英語English
Semester	火/Tue.	2			D304	011105BD	英語中級B BD	Intermediate English B BD	CROWLEY Kevin	CROWLEY Kevin		1	言語/Language	英語English
Semester	火/Tue.	2			D106	011105BE	英語中級B BE	Intermediate English B BE	衛藤 智子	ETO Tomoko		1	言語/Language	英語English
Semester	火/Tue.	2			D203	011105BF	英語中級B BF	Intermediate English B BF	USREY Kaylin Rose	USREY Kaylin Rose		1	言語/Language	英語English
Semester	火/Tue.	2			D110	011105BG	英語中級B BG	Intermediate English B BG	サンダーズ 美里	SAUNDERS Misato		1	言語/Language	英語English
Semester	火/Tue.	2			D202	011105BH	英語中級B BH	Intermediate English B BH	BLACKWELL James	BLACKWELL James		1	言語/Language	英語English
Semester	火/Tue.	2			D210	011105BI	英語中級B BI	Intermediate English B BI	SCHWEHR Owen Richard	SCHWEHR Owen Richard		1	言語/Language	英語English
Semester	火/Tue.	2			D213	011105BJ	英語中級B BJ	Intermediate English B BJ	KRALIKAUSKAS Ellada	KRALIKAUSKAS Ellada		1	言語/Language	英語English
Semester	火/Tue.	2			D303	011106AA	英語準上級A AA	Upper Intermediate English A AA	MEDLEY Nicholas	MEDLEY Nicholas		1	言語/Language	英語English
Semester	火/Tue.	2			D208	011106AB	英語準上級A AB	Upper Intermediate English A AB	PRIEST David	PRIEST David		1	言語/Language	英語English
Semester	火/Tue.	2			D302	011106AC	英語準上級A AC	Upper Intermediate English A AC	ARMSTRONG Luke	ARMSTRONG Luke		1	言語/Language	英語English
Semester	火/Tue.	2			D211	011106AD	英語準上級A AD	Upper Intermediate English A AD	YIP Jordan	YIP Jordan		1	言語/Language	英語English
Semester	火/Tue.	2			D201	011106AE	英語準上級A AE	Upper Intermediate English A AE	HERRERA Girlie Ann	HERRERA Girlie Ann R.		1	言語/Language	英語English
Semester	火/Tue.	2			D111	011106AF	英語準上級A AF	Upper Intermediate English A AF	JAI Rheumi Rhubi	JAI Rheumi Rhubi		1	言語/Language	英語English
Semester	火/Tue.	2			D206	011106AG	英語準上級A AG	Upper Intermediate English A AG	PRIEST William	PRIEST William		1	言語/Language	英語English
Semester	火/Tue.	2			F301	011106AH	英語準上級A AH	Upper Intermediate English A AH	GIACOMELLI Joely	GIACOMELLI Joely		1	言語/Language	英語English
Semester	火/Tue.	2			D209	011106AI	英語準上級A AI	Upper Intermediate English A AI	PIKE Luke Richard	PIKE Luke Richard		1	言語/Language	英語English
Semester	火/Tue.	2			D212	011201BA	英語上級1B BA	Advanced English 1B BA	RENTLER Benjamin	RENTLER Benjamin Robert		1	言語/Language	言語教育科目および共通教養科目Language Education Subjects and Common Liberal Arts Subjects
Semester	火/Tue.	2			FⅡ321	011202AA	英語上級2A AA	Advanced English 2A AA	MACK Lindsay	MACK Lindsay		1	言語/Language	言語教育科目および共通教養科目Language Education Subjects and Common Liberal Arts Subjects
Semester	火/Tue.	2			F110	1160201	日本語プロジェクトC 01	Japanese Project C 01	寺嶋 弘道	TERAJIMA Hiromichi		1	言語/Language	-
Semester	火/Tue.	2			FⅡ323	1180201	英語ディスカッションとディベート 01	English for Discussion and Debate 01	SEVIGNY Paul	SEVIGNY Paul		1	言語/Language	言語教育科目および共通教養科目Language Education Subjects and Common Liberal Arts Subjects
Semester	火/Tue.	2			F112	1700401	日本語・日本文化 01	Language and Culture in Japan 01	住田 環	SUMIDA Tamaki		1	言語/Language	言語教育科目および共通教養科目Language Education Subjects and Common Liberal Arts Subjects
Semester	火/Tue.	2			IPS 6	020038EA	GIS入門EA	Introduction to GISEA	NISHANTHA Giguruwa	NISHANTHA Giguruwa	E	3	教養/Liberal Arts	共通教養科目Common Liberal Arts Subjects
Semester	火/Tue.	2			F203	020051EA	生命倫理EA	BioethicsEA	阿 娜	A Na	E	1	教養/Liberal Arts	共通教養科目Common Liberal Arts Subjects
Semester	火/Tue.	2			IPS 3	020255JF	特殊講義（共通教養科目）JF	Special Lecture (Liberal Arts Subject)JF	平田 純一	HIRATA JUNICHI	J	1	教養/Liberal Arts	共通教養科目Common Liberal Arts Subjects
Semester	火/Tue.	2			J203	027003EB	統計学EB	StatisticsEB	LANGLEY Raymond	LANGLEY Raymond	E	2	教養/Liberal Arts	共通教養科目Common Liberal Arts Subjects
Semester	火/Tue.	2			J105	027006JB	海外学習デザインJB	Overseas Learning DesignJB	カッティング 美紀	CUTTING Miki	J	1	教養/Liberal Arts	共通教養科目Common Liberal Arts Subjects
Semester	火/Tue.	2			和心庵	027029ED	茶道ED	Japanese Art of Tea CeremonyED	宗泰 ポンパン	SOTAI Pongpan	E	3	教養/Liberal Arts	共通教養科目Common Liberal Arts Subjects
Semester	火/Tue.	2			F106	030346JA	ホスピタリティ・マーケティングJA	Hospitality MarketingJA	橋本 俊作	HASHIMOTO Shunsaku	J	3	専門/Major	APS専門教育科目APS Major Education Subjects orHT専門教育科目(*2)HT Major Education Subjects (*2)
Semester	火/Tue.	2			F105	032015JA	国際政治史JA	History of International PoliticsJA	綛田 芳憲	KASEDA Yoshinori	J	3	専門/Major	APS専門教育科目APS Major Education Subjects orIRP専門教育科目(*3)IRP Major Education Subjects (*3)
Semester	火/Tue.	2			T.B.A.	3306010	専門演習Ⅰ10	Major Seminar I10	藤本 武士	FUJIMOTO Takeshi	E/J	6-May	他学部/Other College	他学部科目Other College Subjects
Semester	火/Tue.	2			SPR 2	3306023	専門演習Ⅰ23	Major Seminar I23	大竹 敏次	OTAKE Toshitsugu	E/J	6-May	他学部/Other College	他学部科目Other College Subjects
1Q	火/Tue.	2			F201	021015JA	アジア太平洋の文化と社会JA	Culture and Society of the Asia PacificJA	金 賛會	KIM Chan Hoe	J	1	教養/Liberal Arts	共通教養科目Common Liberal Arts Subjects
1Q	火/Tue.	2			FⅡ220	030602JB	コーポレート・ファイナンスJB	Corporate FinanceJB	渡邉 正太郎	WATANABE Shotaro	J	3	他学部/Other College	他学部科目Other College Subjects
1Q	火/Tue.	2			J102	033019EA	アントレプレナーシップEA	EntrepreneurshipEA	牧野 恵美	MAKINO Emi	E	3	他学部/Other College	他学部科目Other College Subjects
1Q	火/Tue.	2			H101	037132EG	環境・開発　特殊講義EG	Special Lecture in Environment and DevelopmentEG	松尾 雄司	MATSUO Yuji	E	5	専門/Major	APS専門教育科目APS Major Education Subjects orED専門教育科目(*1)ED Major Education Subjects(*1) 
2Q	火/Tue.	2			T.B.A.	030032EA	言語と社会EA	Language and SocietyEA	ASKEW David J.	ASKEW David J.	E	3	専門/Major	APS専門教育科目APS Major Education Subjects orCSM専門教育科目(*4)CSM Major Education Subjects (*4)
2Q	火/Tue.	2			T.B.A.	032081EA	国際経済学EA	International EconomicsEA	金 相鎬	KIM Sangho	E	5	専門/Major	APS専門教育科目APS Major Education Subjects orED専門教育科目(*1)ED Major Education Subjects(*1) 
2Q	火/Tue.	2			T.B.A.	037120JA	人文学と近代JA	The Humanities and ModernityJA	ASKEW 里枝	ASKEW Rie	J	3	専門/Major	APS専門教育科目APS Major Education Subjects orCSM専門教育科目(*4)CSM Major Education Subjects (*4)
2Q	火/Tue.	2			T.B.A.	037123JA	文化・社会・メディア　特殊講義JA	Special Lecture in Culture, Society and MediaJA	金 賛會	KIM Chan Hoe	J	5	専門/Major	APS専門教育科目APS Major Education Subjects orCSM専門教育科目(*4)CSM Major Education Subjects (*4)
2Q	火/Tue.	2			T.B.A.	037132EF	環境・開発　特殊講義EF	Special Lecture in Environment and DevelopmentEF	K C Dipendra	K C Dipendra	E	5	専門/Major	APS専門教育科目APS Major Education Subjects orED専門教育科目(*1)ED Major Education Subjects(*1) 
2Q	火/Tue.	2			T.B.A.	037203EA	ファイナンス　特殊講義EA	Special Lecture in FinanceEA	渡邉 正太郎	WATANABE Shotaro	E	5	他学部/Other College	他学部科目Other College Subjects
2Q	火/Tue.	2			T.B.A.	037207EA	経済学　特殊講義EA	Special Lecture in EconomicsEA	ZHANG Wei-Bin.	ZHANG Wei-Bin.	E	5	他学部/Other College	他学部科目Other College Subjects
Semester	火/Tue.	3			D108	010091AG	日本語初級Ⅱ AG	Japanese Foundation Course II AG	板橋 民子	ITABASHI Tamiko		1	言語/Language	-
Semester	火/Tue.	3			F207	010091AH	日本語初級Ⅱ AH	Japanese Foundation Course II AH	後藤 美智子	GOTO Michiko		1	言語/Language	-
Semester	火/Tue.	3			F303	010091BA	日本語初級Ⅱ BA	Japanese Foundation Course II BA	米 冰寒	MI Binghan		1	言語/Language	-
Semester	火/Tue.	3			F208	010091BB	日本語初級Ⅱ BB	Japanese Foundation Course II BB	栃原 玲子	TOCHIHARA Reiko		1	言語/Language	-
Semester	火/Tue.	3			F211	010091BC	日本語初級Ⅱ BC	Japanese Foundation Course II BC	山門 健二	YAMADO Kenji		1	言語/Language	-
Semester	火/Tue.	3			FⅡ229	010091BD	日本語初級Ⅱ BD	Japanese Foundation Course II BD	バナ 登美子	BONNAH Tomiko		1	言語/Language	-
Semester	火/Tue.	3			F205	010091BE	日本語初級Ⅱ BE	Japanese Foundation Course II BE	井筒 琴子	IZUTSU Kotomi		1	言語/Language	-
Semester	火/Tue.	3			F302	010091BF	日本語初級Ⅱ BF	Japanese Foundation Course II BF	大内 由紀	OUCHI Yuki		1	言語/Language	-
Semester	火/Tue.	3			F212	010092BJ	日本語初級Ⅲ BJ	Japanese Foundation Course III BJ	石村 文恵	ISHIMURA Fumie		1	言語/Language	-
Semester	火/Tue.	3			D213	010092BL	日本語初級Ⅲ BL	Japanese Foundation Course III BL	山田 祐也	YAMADA YUYA		1	言語/Language	-
Semester	火/Tue.	3			FⅡ230	010092BM	日本語初級Ⅲ BM	Japanese Foundation Course III BM	高野 涼子	TAKANO Ryoko		1	言語/Language	-
Semester	火/Tue.	3			F112	010101BA	日本語中級 BA	Japanese Intermediate Course BA	住田 環	SUMIDA Tamaki		1	言語/Language	-
Semester	火/Tue.	3			F206	010101BB	日本語中級 BB	Japanese Intermediate Course BB	吉田 真宏	YOSHIDA Masahiro		1	言語/Language	-
Semester	火/Tue.	3			D107	010101BC	日本語中級 BC	Japanese Intermediate Course BC	深山 道助	MIYAMA MICHISUKE		1	言語/Language	-
Semester	火/Tue.	3			F214	010101BD	日本語中級 BD	Japanese Intermediate Course BD	小野田 千絵	ONODA Chie		1	言語/Language	-
Semester	火/Tue.	3			D305	010101BE	日本語中級 BE	Japanese Intermediate Course BE	多田 利恵	TADA Rie		1	言語/Language	-
Semester	火/Tue.	3			F213	010101BF	日本語中級 BF	Japanese Intermediate Course BF	大池 森	OIKE SHIN		1	言語/Language	-
Semester	火/Tue.	3			FⅡ231	010101BG	日本語中級 BG	Japanese Intermediate Course BG	佐々木 美江	SASAKI Mie		1	言語/Language	-
Semester	火/Tue.	3			D203	010102BA	日本語中上級 BA	Pre-Advanced Japanese BA	渡辺 若菜	WATANABE Wakana		1	言語/Language	-
Semester	火/Tue.	3			F304	010102BB	日本語中上級 BB	Pre-Advanced Japanese BB	高田 亮	TAKADA Ryo		1	言語/Language	-
Semester	火/Tue.	3			D109	010102BC	日本語中上級 BC	Pre-Advanced Japanese BC	水戸 貴久	MITO Takahisa		1	言語/Language	-
Semester	火/Tue.	3			D106	010102BD	日本語中上級 BD	Pre-Advanced Japanese BD	板井 芳江	ITAI Yoshie		1	言語/Language	-
Semester	火/Tue.	3			D207	010103BA	日本語上級 BA	Advanced Japanese BA	井上 佳子	INOUE Yoshiko		1	言語/Language	-
Semester	火/Tue.	3			FⅡ320	010180SB	中国語Ⅰ SB	Chinese I SB	PANG Longjie	PANG Longjie		1	言語/Language	言語教育科目および共通教養科目Language Education Subjects and Common Liberal Arts Subjects
Semester	火/Tue.	3			FⅡ322	010180SD	中国語Ⅰ SD	Chinese I SD	張 玲	ZHANG Ling		1	言語/Language	言語教育科目および共通教養科目Language Education Subjects and Common Liberal Arts Subjects
Semester	火/Tue.	3			FⅡ321	010180SG	中国語Ⅰ SG	Chinese I SG	河原畑 希久	KAWARABATA Kiku		1	言語/Language	言語教育科目および共通教養科目Language Education Subjects and Common Liberal Arts Subjects
Semester	火/Tue.	3			FⅡ324	010190SB	中国語Ⅱ SB	Chinese II SB	張 文青	ZHANG Wenqing		1	言語/Language	言語教育科目および共通教養科目Language Education Subjects and Common Liberal Arts Subjects
