2025年度春セメスター　時間割 (2017カリキュラムAPS生対象科目)														
AY2025 Spring Semester Timetable (For 2017 APS Curriculum students)														
														
"-Online講義は、D列に「〇」が記載されています。講義名の先頭に開講形態(Online)が記載されています。何も記載がない場合には原則対面講義となります。
-「配当セメ」の数字はその科目を受講することができるセメスターを示しています。（例）「3」と記載されている場合には、3セメスター生以上の学生が履修することができます。
-各科目の履修要件（単位数・前提科目・履修制限・単位集計分野、登録可能な期間等）については、科目一覧表をご確認ください（アカデミック・オフィスHP＞第8～10章＞カリキュラム図・科目一覧）。

-For Online Lectures, ""〇"" is marked in column D. Forms of class implementation (Online) are included as part of the 'Subject Name' . If there is no specification, it means that the class is offered on-campus.
-The number for ""Semester"" indicates the semester in which that course can be taken. （Ex） if a ""3"" is written, students in their 3rd semester and above can take the course.
-Please refer to the course list for the requirements of each course (credit units, prerequisite courses, registration restrictions, credit requirement area, 「registration availability during course registration periods, etc). You can find the course list on the Academic Office website (Chapters 8-10 > Curriculum Diagrams & Course Lists)  "														
"・単位集計分野に関する注意点/Credit Requirement Area – Note

APS専門科目はAPS専門教育科目 or 選択した学修分野に応じて以下のいずれかに集計されます。
/Credits earned for APS Major Education Subjects will count towards your credit requirements for either “APS Major Education Subjects” or one of the following depending on your registered Area of Study.
*1：学修分野 EDを選択した人は、ED専門教育科目として集計されます。/*1: “ED Major Education Subjects” if your registered Area of Study is ED.
*2：学修分野 HTを選択した人は、HT専門教育科目として集計されます。/*2: “HT Major Education Subjects” if your registered Area of Study is HT.
*3：学修分野 IRPを選択した人は、IRP専門教育科目として集計されます。/*3: “IRP Major Education Subjects” if your registered Area of Study is IRP.
*4：学修分野 CSMを選択した人は、CSM専門教育科目として集計されます。/*4: “CSM Major Education Subjects” if your registered Area of Study is CSM.
なお、選択した学修分野の専門教育科目修得単位数が必要単位数を超えた場合、超過分はAPS専門教育科目分野に集計されます。 /If you earn more than the required number of credits for your registered Area of Study’s Major Education Subjects, the excess credits will count towards “APS Major Education Subjects” instead.
"														
Ver.20250331														
"期間/
Term"	"曜日/
Day of Week"	"時限/
Period"	Online	"Zoom 
MTG ID "	"教室/
Classroom"	"講義CD/
Subject CD"	講義名	Subject Name	担当教員	Instructor	"言語/
Lang."	配当セメ/Semester	分野/Field	専門分野/Area of Major
														
Semester	月/Mon.	1			F206	010081BA	日本語初級Ⅰ BA	Japanese Foundation Course I BA	高松 知恵美	TAKAMATSU Chiemi		1	言語/Language	-
Semester	月/Mon.	1			F213	010081BB	日本語初級Ⅰ BB	Japanese Foundation Course I BB	水戸 貴久	MITO Takahisa		1	言語/Language	-
Semester	月/Mon.	1			FⅡ230	010081BC	日本語初級Ⅰ BC	Japanese Foundation Course I BC	栃原 玲子	TOCHIHARA Reiko		1	言語/Language	-
Semester	月/Mon.	1			F208	010081BD	日本語初級Ⅰ BD	Japanese Foundation Course I BD	星野 智子	HOSHINO Tomoko		1	言語/Language	-
Semester	月/Mon.	1			F214	010081BE	日本語初級Ⅰ BE	Japanese Foundation Course I BE	板井 芳江	ITAI Yoshie		1	言語/Language	-
Semester	月/Mon.	1			F111	010081BF	日本語初級Ⅰ BF	Japanese Foundation Course I BF	布尾 勝一郎	NUNOO Katsuichiro		1	言語/Language	-
Semester	月/Mon.	1			J303	010220SH	韓国語Ⅰ SH	Korean I SH	朴 ウギョン	PARK Woo kyoung		1	言語/Language	言語教育科目および共通教養科目Language Education Subjects and Common Liberal Arts Subjects
Semester	月/Mon.	1			FⅡ224	010290SC	スペイン語Ⅰ SC	Spanish I SC	VILA LOPEZ Eduardo	VILA LOPEZ Eduardo		1	言語/Language	言語教育科目および共通教養科目Language Education Subjects and Common Liberal Arts Subjects
Semester	月/Mon.	1			D110	011101BI	英語初級B BI	Elementary English B BI	サンダーズ 美里	SAUNDERS Misato		1	言語/Language	英語English
Semester	月/Mon.	1			D203	011103BG	英語準中級B BG	Pre-Intermediate English B BG	KERR Joshua	KERR Joshua Earl		1	言語/Language	英語English
Semester	月/Mon.	1			D205	011103BH	英語準中級B BH	Pre-Intermediate English B BH	SILVA Matthew Shawn	SILVA Matthew Shawn		1	言語/Language	英語English
Semester	月/Mon.	1			D214	011103BI	英語準中級B BI	Pre-Intermediate English B BI	GEDARRO Randy Yoshio	GEDARRO Randy Yoshio		1	言語/Language	英語English
Semester	月/Mon.	1			D101	011103BJ	英語準中級B BJ	Pre-Intermediate English B BJ	廣松 大和	HIROMATSU Yamato		1	言語/Language	英語English
Semester	月/Mon.	1			D304	011103BK	英語準中級B BK	Pre-Intermediate English B BK	CROWLEY Kevin	CROWLEY Kevin		1	言語/Language	英語English
Semester	月/Mon.	1			D213	011103BL	英語準中級B BL	Pre-Intermediate English B BL	KRALIKAUSKAS Ellada	KRALIKAUSKAS Ellada		1	言語/Language	英語English
Semester	月/Mon.	1			D302	011202AB	英語上級2A AB	Advanced English 2A AB	ARMSTRONG Luke	ARMSTRONG Luke		1	言語/Language	言語教育科目および共通教養科目Language Education Subjects and Common Liberal Arts Subjects
Semester	月/Mon.	1			F104	020031EA	経済学入門EA	Introduction to EconomicsEA	中神 正史	NAKAGAMI Masafumi	E	2	教養/Liberal Arts	共通教養科目Common Liberal Arts Subjects
Semester	月/Mon.	1			IPS 2	020091ED	コンピューターリテラシーED	Computer LiteracyED	KHAN Muhammad T.	KHAN Muhammad T.	E	1	教養/Liberal Arts	共通教養科目Common Liberal Arts Subjects
Semester	月/Mon.	1			IPS 4	027003ED	統計学ED	StatisticsED	RUIZ-NAVAS Santiago	RUIZ-NAVAS Santiago	E	2	教養/Liberal Arts	共通教養科目Common Liberal Arts Subjects
Semester	月/Mon.	1			和心庵	027029EA	茶道EA	Japanese Art of Tea CeremonyEA	宗泰 ポンパン	SOTAI Pongpan	E	3	教養/Liberal Arts	共通教養科目Common Liberal Arts Subjects
Semester	月/Mon.	1			FⅡ221	030571JA	会計学ⅠJA	Accounting IJA	佐藤 浩人	SATO Hiroto	J	3	他学部/Other College	他学部科目Other College Subjects
Semester	月/Mon.	1			FⅡ120	030675EA	アジア経済論EA	Asian EconomyEA	大塚 宏蔵	OTSUKA KOZO	E	5	他学部/Other College	他学部科目Other College Subjects
Semester	月/Mon.	1			F105	030716JB	金融市場と金融制度JB	Financial Market and InstitutionsJB	川添 敬	KAWAZOE Satoshi	J	5	他学部/Other College	他学部科目Other College Subjects
Semester	月/Mon.	1			H101	037135JA	観光・ホスピタリティと法JA	Tourism and Hospitality LawJA	劉 明	RYU Min	J	5	専門/Major	APS専門教育科目APS Major Education Subjects orHT専門教育科目(*2)HT Major Education Subjects (*2)
Semester	月/Mon.	1			FⅡ220	037137EA	健康とウェルネスツーリズムEA	Health and Wellness TourismEA	MEIRMANOV Serik	MEIRMANOV Serik	E	5	専門/Major	APS専門教育科目APS Major Education Subjects orHT専門教育科目(*2)HT Major Education Subjects (*2)
1Q	月/Mon.	1			F106	021012JA	アジア太平洋の地理JA	Geography of the Asia PacificJA	小山 拓志	KOYAMA Takushi	J	1	教養/Liberal Arts	共通教養科目Common Liberal Arts Subjects
1Q	月/Mon.	1			F201	021017EA	アジア太平洋の歴史EA	History of the Asia PacificEA	HAO Xiaoyang	HAO Xiaoyang	E	1	教養/Liberal Arts	共通教養科目Common Liberal Arts Subjects
1Q	月/Mon.	1			J103	027020EA	ネゴシエーションスキルEA	Negotiation SkillsEA	HOOI Carol Lai-Wan	HOOI Carol Lai-Wan	E	1	教養/Liberal Arts	共通教養科目Common Liberal Arts Subjects
1Q	月/Mon.	1			F202	030035JA	社会階層論JA	Social StratificationJA	児島 真爾	KOJIMA Shinji	J	3	専門/Major	APS専門教育科目APS Major Education Subjects orCSM専門教育科目(*4)CSM Major Education Subjects (*4)
1Q	月/Mon.	1			F204	030192JA	国際問題と政策JA	Global Issues and PoliciesJA	綛田 芳憲	KASEDA Yoshinori	J	3	専門/Major	APS専門教育科目APS Major Education Subjects orIRP専門教育科目(*3)IRP Major Education Subjects (*3)
1Q	月/Mon.	1			FⅡ121	030550EE	特殊講義（専門教育科目）EE	Special Lecture(Asia Pacific Studies)EE	岡村 善文	OKAMURA Yoshifumi	E	3	専門/Major	APS専門教育科目APS Major Education Subjects 
1Q	月/Mon.	1			F203	033023EA	販売・プロモーションマネジメントEA	Promotion and Sales ManagementEA	CHEN Shu-Ching	CHEN Shu-Ching	E	3	他学部/Other College	他学部科目Other College Subjects
2Q	月/Mon.	1			T.B.A.	027009JA	ロジカルシンキングとフレームワークJA	Logical Thinking and FrameworkJA	煤田 徳東	SUSUDA Yoshihide	J	1	教養/Liberal Arts	共通教養科目Common Liberal Arts Subjects
2Q	月/Mon.	1			T.B.A.	030262JA	生物多様性JA	BiodiversityJA	山浦 紘一	YAMAURA Koichi	J	3	専門/Major	APS専門教育科目APS Major Education Subjects orED専門教育科目(*1)ED Major Education Subjects(*1) 
2Q	月/Mon.	1			T.B.A.	030760JA	消費者行動論JA	Consumer BehaviorJA	蛯谷 憲治	EBITANI Kenji	J	3	他学部/Other College	他学部科目Other College Subjects
2Q	月/Mon.	1			T.B.A.	037107JA	農業遺産とツーリズムJA	Agri-heritage and TourismJA	林 浩昭	HAYASHI Hiroaki	J	5	専門/Major	APS専門教育科目APS Major Education Subjects orHT専門教育科目(*2)HT Major Education Subjects (*2)
2Q	月/Mon.	1			T.B.A.	037132EB	環境・開発　特殊講義EB	Special Lecture in Environment and DevelopmentEB	山根 友美	YAMANE Tomomi	E	5	専門/Major	APS専門教育科目APS Major Education Subjects orED専門教育科目(*1)ED Major Education Subjects(*1) 
Semester	月/Mon.	2			F304	010081AA	日本語初級Ⅰ AA	Japanese Foundation Course I AA	米 冰寒	MI Binghan		1	言語/Language	-
Semester	月/Mon.	2			F211	010081AB	日本語初級Ⅰ AB	Japanese Foundation Course I AB	寺井 敦子	TERAI Atsuko		1	言語/Language	-
Semester	月/Mon.	2			F213	010081AC	日本語初級Ⅰ AC	Japanese Foundation Course I AC	成 利楽	CHENG Lile		1	言語/Language	-
Semester	月/Mon.	2			F212	010081AD	日本語初級Ⅰ AD	Japanese Foundation Course I AD	寺本 真悠子	TERAMOTO Mayuko		1	言語/Language	-
Semester	月/Mon.	2			F207	010081AE	日本語初級Ⅰ AE	Japanese Foundation Course I AE	山門 健二	YAMADO Kenji		1	言語/Language	-
Semester	月/Mon.	2			F302	010081AF	日本語初級Ⅰ AF	Japanese Foundation Course I AF	大内 由紀	OUCHI Yuki		1	言語/Language	-
Semester	月/Mon.	2			F111	010101AA	日本語中級 AA	Japanese Intermediate Course AA	布尾 勝一郎	NUNOO Katsuichiro		1	言語/Language	-
Semester	月/Mon.	2			D107	010101AB	日本語中級 AB	Japanese Intermediate Course AB	深山 道助	MIYAMA MICHISUKE		1	言語/Language	-
Semester	月/Mon.	2			D305	010101AC	日本語中級 AC	Japanese Intermediate Course AC	多田 利恵	TADA Rie		1	言語/Language	-
Semester	月/Mon.	2			F214	010101AD	日本語中級 AD	Japanese Intermediate Course AD	小野田 千絵	ONODA Chie		1	言語/Language	-
Semester	月/Mon.	2			FⅡ230	010101AE	日本語中級 AE	Japanese Intermediate Course AE	栃原 玲子	TOCHIHARA Reiko		1	言語/Language	-
Semester	月/Mon.	2			F208	010101AF	日本語中級 AF	Japanese Intermediate Course AF	星野 智子	HOSHINO Tomoko		1	言語/Language	-
Semester	月/Mon.	2			F303	010101AG	日本語中級 AG	Japanese Intermediate Course AG	津田 真理子	TSUDA Mariko		1	言語/Language	-
Semester	月/Mon.	2			FⅡ231	010101AH	日本語中級 AH	Japanese Intermediate Course AH	佐々木 美江	SASAKI Mie		1	言語/Language	-
Semester	月/Mon.	2			F205	010102AA	日本語中上級 AA	Pre-Advanced Japanese AA	石村 文恵	ISHIMURA Fumie		1	言語/Language	-
Semester	月/Mon.	2			F108	010102AB	日本語中上級 AB	Pre-Advanced Japanese AB	伊藤 俊也	ITO Toshinari		1	言語/Language	-
Semester	月/Mon.	2			F206	010102AC	日本語中上級 AC	Pre-Advanced Japanese AC	高松 知恵美	TAKAMATSU Chiemi		1	言語/Language	-
Semester	月/Mon.	2			FⅡ229	010103AA	日本語上級 AA	Advanced Japanese AA	廣津 公子	HIROTSU Koko		1	言語/Language	-
Semester	月/Mon.	2			D108	010103AB	日本語上級 AB	Advanced Japanese AB	板橋 民子	ITABASHI Tamiko		1	言語/Language	-
Semester	月/Mon.	2			FⅡ320	010180SC	中国語Ⅰ SC	Chinese I SC	河原畑 希久	KAWARABATA Kiku		1	言語/Language	言語教育科目および共通教養科目Language Education Subjects and Common Liberal Arts Subjects
Semester	月/Mon.	2			FⅡ328	010180SJ	中国語Ⅰ SJ	Chinese I SJ	張 玲	ZHANG Ling		1	言語/Language	言語教育科目および共通教養科目Language Education Subjects and Common Liberal Arts Subjects
Semester	月/Mon.	2			FⅡ325	010190SA	中国語Ⅱ SA	Chinese II SA	羅 華	LUO Hua		1	言語/Language	言語教育科目および共通教養科目Language Education Subjects and Common Liberal Arts Subjects
Semester	月/Mon.	2			FⅡ323	010200SB	中国語Ⅲ SB	Chinese III SB	王 楓	WANG Feng		1	言語/Language	言語教育科目および共通教養科目Language Education Subjects and Common Liberal Arts Subjects
Semester	月/Mon.	2			J307	010220SA	韓国語Ⅰ SA	Korean I SA	李 ソヨン	LEE Soyeong		1	言語/Language	言語教育科目および共通教養科目Language Education Subjects and Common Liberal Arts Subjects
Semester	月/Mon.	2			J305	010220SG	韓国語Ⅰ SG	Korean I SG	朴 映勳	PARK YoungHoon		1	言語/Language	言語教育科目および共通教養科目Language Education Subjects and Common Liberal Arts Subjects
Semester	月/Mon.	2			J308	010220SI	韓国語Ⅰ SI	Korean I SI	金 奈愛	KIM Naae		1	言語/Language	言語教育科目および共通教養科目Language Education Subjects and Common Liberal Arts Subjects
Semester	月/Mon.	2			J303	010230SA	韓国語Ⅱ SA	Korean II SA	朴 ウギョン	PARK Woo kyoung		1	言語/Language	言語教育科目および共通教養科目Language Education Subjects and Common Liberal Arts Subjects
Semester	月/Mon.	2			FⅡ327	010260SA	マレー語･インドネシア語Ⅰ SA	Malay/Indonesian I SA	ELVITA Wiasih	ELVITA Wiasih		1	言語/Language	言語教育科目および共通教養科目Language Education Subjects and Common Liberal Arts Subjects
Semester	月/Mon.	2			FⅡ329	010260SE	マレー語･インドネシア語Ⅰ SE	Malay/Indonesian I SE	藤崎 拓海	FUJISAKI Takumi		1	言語/Language	言語教育科目および共通教養科目Language Education Subjects and Common Liberal Arts Subjects
Semester	月/Mon.	2			FⅡ326	010270SA	マレー語･インドネシア語Ⅱ SA	Malay/Indonesian II SA	SRI Budi Lestari	SRI Budi Lestari		1	言語/Language	言語教育科目および共通教養科目Language Education Subjects and Common Liberal Arts Subjects
Semester	月/Mon.	2			FⅡ223	010290SA	スペイン語Ⅰ SA	Spanish I SA	福川 美沙	FUKUKAWA Misa		1	言語/Language	言語教育科目および共通教養科目Language Education Subjects and Common Liberal Arts Subjects
Semester	月/Mon.	2			FⅡ224	010290SD	スペイン語Ⅰ SD	Spanish I SD	VILA LOPEZ Eduardo	VILA LOPEZ Eduardo		1	言語/Language	言語教育科目および共通教養科目Language Education Subjects and Common Liberal Arts Subjects
Semester	月/Mon.	2			FⅡ225	010300SC	スペイン語Ⅱ SC	Spanish II SC	MOLINA Noemi	MOLINA RODRIGUEZ Noemi		1	言語/Language	言語教育科目および共通教養科目Language Education Subjects and Common Liberal Arts Subjects
Semester	月/Mon.	2			FⅡ228	010320SB	タイ語Ⅰ SB	Thai I SB	PHANKHIAN Areeluck	PHANKHIAN Areeluck		1	言語/Language	言語教育科目および共通教養科目Language Education Subjects and Common Liberal Arts Subjects
Semester	月/Mon.	2			FⅡ226	010330SA	タイ語Ⅱ SA	Thai II SA	LIMTHANANUNTHA P.	LIMTHANANUNTHA Phenssinee		1	言語/Language	言語教育科目および共通教養科目Language Education Subjects and Common Liberal Arts Subjects
Semester	月/Mon.	2			FⅡ330	010370SA	ベトナム語Ⅲ SA	Vietnamese III SA	NGUYEN Hoang Minh	NGUYEN Hoang Minh		1	言語/Language	言語教育科目および共通教養科目Language Education Subjects and Common Liberal Arts Subjects
Semester	月/Mon.	2			D214	011100AA	英語初級A AA	Elementary English A AA	PIGNOLET Lucas	PIGNOLET Lucas		1	言語/Language	英語English
Semester	月/Mon.	2			D301	011100AB	英語初級A AB	Elementary English A AB	LARKING Malcolm	LARKING Malcolm		1	言語/Language	英語English
Semester	月/Mon.	2			FⅡ123	011100AC	英語初級A AC	Elementary English A AC	斉藤 沙綾香	SAITO Sayaka		1	言語/Language	英語English
Semester	月/Mon.	2			FⅡ124	011100AD	英語初級A AD	Elementary English A AD	石毛 愛佳	ISHIGE Aika		1	言語/Language	英語English
Semester	月/Mon.	2			D104	011100AE	英語初級A AE	Elementary English A AE	BERNARD Malia Ana	BERNARD Malia Ana		1	言語/Language	英語English
Semester	月/Mon.	2			D103	011100AF	英語初級A AF	Elementary English A AF	BEUCKENS Roger Todd	BEUCKENS Roger Todd		1	言語/Language	英語English
Semester	月/Mon.	2			D212	011103BA	英語準中級B BA	Pre-Intermediate English B BA	MARZONA Nikki	MARZONA Nikki		1	言語/Language	英語English
Semester	月/Mon.	2			D304	011103BB	英語準中級B BB	Pre-Intermediate English B BB	CROWLEY Kevin	CROWLEY Kevin		1	言語/Language	英語English
Semester	月/Mon.	2			D204	011103BC	英語準中級B BC	Pre-Intermediate English B BC	JONES Kent	JONES Kent		1	言語/Language	英語English
Semester	月/Mon.	2			D109	011103BD	英語準中級B BD	Pre-Intermediate English B BD	HU Cindy Hsin Yu	HU Cindy Hsin Yu		1	言語/Language	英語English
Semester	月/Mon.	2			D203	011103BE	英語準中級B BE	Pre-Intermediate English B BE	KERR Joshua	KERR Joshua Earl		1	言語/Language	英語English
Semester	月/Mon.	2			D213	011103BF	英語準中級B BF	Pre-Intermediate English B BF	KRALIKAUSKAS Ellada	KRALIKAUSKAS Ellada		1	言語/Language	英語English
Semester	月/Mon.	2			D303	011106AA	英語準上級A AA	Upper Intermediate English A AA	MEDLEY Nicholas	MEDLEY Nicholas		1	言語/Language	英語English
Semester	月/Mon.	2			D208	011106AB	英語準上級A AB	Upper Intermediate English A AB	PRIEST David	PRIEST David		1	言語/Language	英語English
Semester	月/Mon.	2			D302	011106AC	英語準上級A AC	Upper Intermediate English A AC	ARMSTRONG Luke	ARMSTRONG Luke		1	言語/Language	英語English
Semester	月/Mon.	2			D211	011106AD	英語準上級A AD	Upper Intermediate English A AD	YIP Jordan	YIP Jordan		1	言語/Language	英語English
Semester	月/Mon.	2			D201	011106AE	英語準上級A AE	Upper Intermediate English A AE	HERRERA Girlie Ann	HERRERA Girlie Ann R.		1	言語/Language	英語English
Semester	月/Mon.	2			D111	011106AF	英語準上級A AF	Upper Intermediate English A AF	JAI Rheumi Rhubi	JAI Rheumi Rhubi		1	言語/Language	英語English
Semester	月/Mon.	2			D206	011106AG	英語準上級A AG	Upper Intermediate English A AG	PRIEST William	PRIEST William		1	言語/Language	英語English
Semester	月/Mon.	2			F301	011106AH	英語準上級A AH	Upper Intermediate English A AH	GIACOMELLI Joely	GIACOMELLI Joely		1	言語/Language	英語English
Semester	月/Mon.	2			D209	011106AI	英語準上級A AI	Upper Intermediate English A AI	PIKE Luke Richard	PIKE Luke Richard		1	言語/Language	英語English
Semester	月/Mon.	2			FⅡ321	011202AA	英語上級2A AA	Advanced English 2A AA	MACK Lindsay	MACK Lindsay		1	言語/Language	言語教育科目および共通教養科目Language Education Subjects and Common Liberal Arts Subjects
Semester	月/Mon.	2			F110	1701901	日本語教育のための日本語学 01	Japanese Linguistics for Japanese Language Education 01	本田 明子	HONDA Akiko		3	言語/Language	言語教育科目および共通教養科目Language Education Subjects and Common Liberal Arts Subjects
Semester	月/Mon.	2			IPS 2	020097EA	データベースシステムEA	Database SystemsEA	KHAN Muhammad T.	KHAN Muhammad T.	E	5	教養/Liberal Arts	共通教養科目Common Liberal Arts Subjects
Semester	月/Mon.	2			和心庵	027029EB	茶道EB	Japanese Art of Tea CeremonyEB	宗泰 ポンパン	SOTAI Pongpan	E	3	教養/Liberal Arts	共通教養科目Common Liberal Arts Subjects
Semester	月/Mon.	2			FⅡ221	030717EA	投資・証券分析EA	Investment and Securities AnalysisEA	BARAI Munim Kumar	BARAI Munim Kumar	E	5	他学部/Other College	他学部科目Other College Subjects
Semester	月/Mon.	2			SPR 4	3306008	専門演習Ⅰ08	Major Seminar I08	CORTEZ Michael A.	CORTEZ Michael A.	E	6-May	他学部/Other College	他学部科目Other College Subjects
Semester	月/Mon.	2			T.B.A.	3306028	専門演習Ⅰ28	Major Seminar I28	重本 彰子	SHIGEMOTO Akiko	J	6-May	他学部/Other College	他学部科目Other College Subjects
Semester	月/Mon.	2			SPR 2	3306029	専門演習Ⅰ29	Major Seminar I29	篠原 欣貴	SHINOHARA Yoshiki	E/J	6-May	他学部/Other College	他学部科目Other College Subjects
Semester	月/Mon.	2			SPR 1	3306035	専門演習Ⅰ35	Major Seminar I35	柳 ボスル	YOO Bosul	J	6-May	他学部/Other College	他学部科目Other College Subjects
Semester	月/Mon.	2			FⅡ120	037116EA	観光経済学EA	Tourism EconomicsEA	BUI Thanh Huong	BUI Thanh Huong	E	5	専門/Major	APS専門教育科目APS Major Education Subjects orHT専門教育科目(*2)HT Major Education Subjects (*2)
Semester	月/Mon.	2			F102	037123EC	文化・社会・メディア　特殊講義EC	Special Lecture in Culture, Society and MediaEC	ASKEW David J.	ASKEW David J.	E	5	専門/Major	APS専門教育科目APS Major Education Subjects orCSM専門教育科目(*4)CSM Major Education Subjects (*4)
Semester	月/Mon.	2			H101	037301JA	組織行動論（上級）JA	Advanced Organizational BehaviorJA	劉 明	RYU Min	J	5	専門/Major	APS専門教育科目APS Major Education Subjects orHT専門教育科目(*2)HT Major Education Subjects (*2)
1Q	月/Mon.	2			F106	021012JA	アジア太平洋の地理JA	Geography of the Asia PacificJA	小山 拓志	KOYAMA Takushi	J	1	教養/Liberal Arts	共通教養科目Common Liberal Arts Subjects
1Q	月/Mon.	2			F201	021017EA	アジア太平洋の歴史EA	History of the Asia PacificEA	HAO Xiaoyang	HAO Xiaoyang	E	1	教養/Liberal Arts	共通教養科目Common Liberal Arts Subjects
1Q	月/Mon.	2			J103	027020EA	ネゴシエーションスキルEA	Negotiation SkillsEA	HOOI Carol Lai-Wan	HOOI Carol Lai-Wan	E	1	教養/Liberal Arts	共通教養科目Common Liberal Arts Subjects
1Q	月/Mon.	2			F202	030035JA	社会階層論JA	Social StratificationJA	児島 真爾	KOJIMA Shinji	J	3	専門/Major	APS専門教育科目APS Major Education Subjects orCSM専門教育科目(*4)CSM Major Education Subjects (*4)
1Q	月/Mon.	2			F204	030192JA	国際問題と政策JA	Global Issues and PoliciesJA	綛田 芳憲	KASEDA Yoshinori	J	3	専門/Major	APS専門教育科目APS Major Education Subjects orIRP専門教育科目(*3)IRP Major Education Subjects (*3)
1Q	月/Mon.	2			FⅡ121	030550EE	特殊講義（専門教育科目）EE	Special Lecture(Asia Pacific Studies)EE	岡村 善文	OKAMURA Yoshifumi	E	3	専門/Major	APS専門教育科目APS Major Education Subjects 
1Q	月/Mon.	2			F203	033023EA	販売・プロモーションマネジメントEA	Promotion and Sales ManagementEA	CHEN Shu-Ching	CHEN Shu-Ching	E	3	他学部/Other College	他学部科目Other College Subjects
2Q	月/Mon.	2			T.B.A.	027009JA	ロジカルシンキングとフレームワークJA	Logical Thinking and FrameworkJA	煤田 徳東	SUSUDA Yoshihide	J	1	教養/Liberal Arts	共通教養科目Common Liberal Arts Subjects
2Q	月/Mon.	2			T.B.A.	030262JA	生物多様性JA	BiodiversityJA	山浦 紘一	YAMAURA Koichi	J	3	専門/Major	APS専門教育科目APS Major Education Subjects orED専門教育科目(*1)ED Major Education Subjects(*1) 
2Q	月/Mon.	2			T.B.A.	030760JA	消費者行動論JA	Consumer BehaviorJA	蛯谷 憲治	EBITANI Kenji	J	3	他学部/Other College	他学部科目Other College Subjects
2Q	月/Mon.	2			T.B.A.	037107JA	農業遺産とツーリズムJA	Agri-heritage and TourismJA	林 浩昭	HAYASHI Hiroaki	J	5	専門/Major	APS専門教育科目APS Major Education Subjects orHT専門教育科目(*2)HT Major Education Subjects (*2)
2Q	月/Mon.	2			T.B.A.	037132EB	環境・開発　特殊講義EB	Special Lecture in Environment and DevelopmentEB	山根 友美	YAMANE Tomomi	E	5	専門/Major	APS専門教育科目APS Major Education Subjects orED専門教育科目(*1)ED Major Education Subjects(*1) 
Semester	月/Mon.	3			D108	010091AG	日本語初級Ⅱ AG	Japanese Foundation Course II AG	板橋 民子	ITABASHI Tamiko		1	言語/Language	-
Semester	月/Mon.	3			F207	010091AH	日本語初級Ⅱ AH	Japanese Foundation Course II AH	後藤 美智子	GOTO Michiko		1	言語/Language	-
Semester	月/Mon.	3			F303	010091BA	日本語初級Ⅱ BA	Japanese Foundation Course II BA	米 冰寒	MI Binghan		1	言語/Language	-
Semester	月/Mon.	3			F208	010091BB	日本語初級Ⅱ BB	Japanese Foundation Course II BB	栃原 玲子	TOCHIHARA Reiko		1	言語/Language	-
Semester	月/Mon.	3			F211	010091BC	日本語初級Ⅱ BC	Japanese Foundation Course II BC	山門 健二	YAMADO Kenji		1	言語/Language	-
